"Status","Start Time","Stop Time","Duration in ms","Parent Suite","Suite","Sub Suite","Test Class","Test Method","Name","Description"
"passed","Sun Dec 12 14:17:27 UTC 2021","Sun Dec 12 14:17:31 UTC 2021","3282","","specs/jetpack-boost/modules-common.test.js","Modules","","","The lazy-images module state should revert back to original state",""
"passed","Sun Dec 12 14:17:33 UTC 2021","Sun Dec 12 14:17:35 UTC 2021","1965","","specs/jetpack-boost/modules-common.test.js","Modules","","","The render-blocking-js module state should toggle to an inverse state",""
"passed","Sun Dec 12 14:17:31 UTC 2021","Sun Dec 12 14:17:33 UTC 2021","1952","","specs/jetpack-boost/modules-common.test.js","Modules","","","The render-blocking-js module should be disabled by default",""
"passed","Sun Dec 12 14:17:25 UTC 2021","Sun Dec 12 14:17:27 UTC 2021","2017","","specs/jetpack-boost/modules-common.test.js","Modules","","","The lazy-images module state should toggle to an inverse state",""
"passed","Sun Dec 12 14:17:17 UTC 2021","Sun Dec 12 14:17:18 UTC 2021","1617","","specs/jetpack-boost/modules-common.test.js","Modules","","","The critical-css module should be disabled by default",""
"skipped","Sun Dec 12 14:17:10 UTC 2021","Sun Dec 12 14:17:10 UTC 2021","0","","specs/homepage.test.js","Homepage","","","Should be ready",""
"passed","Sun Dec 12 14:17:09 UTC 2021","Sun Dec 12 14:17:10 UTC 2021","1343","","specs/homepage.test.js","Homepage","","","Should include the jetpack boost meta tag(s)",""
"passed","Sun Dec 12 14:17:21 UTC 2021","Sun Dec 12 14:17:24 UTC 2021","3158","","specs/jetpack-boost/modules-common.test.js","Modules","","","The critical-css module state should revert back to original state",""
"passed","Sun Dec 12 14:17:24 UTC 2021","Sun Dec 12 14:17:25 UTC 2021","1610","","specs/jetpack-boost/modules-common.test.js","Modules","","","The lazy-images module should be disabled by default",""
"passed","Sun Dec 12 14:17:18 UTC 2021","Sun Dec 12 14:17:21 UTC 2021","2222","","specs/jetpack-boost/modules-common.test.js","Modules","","","The critical-css module state should toggle to an inverse state",""
"passed","Sun Dec 12 14:17:06 UTC 2021","Sun Dec 12 14:17:09 UTC 2021","2566","","specs/homepage.test.js","Homepage","","","Should display ""HelloWord"" text on page",""
"passed","Sun Dec 12 14:17:35 UTC 2021","Sun Dec 12 14:17:37 UTC 2021","2037","","specs/jetpack-boost/modules-common.test.js","Modules","","","The render-blocking-js module state should revert back to original state",""
"passed","Sun Dec 12 14:17:37 UTC 2021","Sun Dec 12 14:17:38 UTC 2021","1654","","specs/jetpack-boost/speed-score.test.js","Speed Score feature","","","Should display a mobile and desktop speed score greater than zero",""
