"Status","Start Time","Stop Time","Duration in ms","Parent Suite","Suite","Sub Suite","Test Class","Test Method","Name","Description"
"passed","Fri Nov 12 16:55:32 UTC 2021","Fri Nov 12 16:55:33 UTC 2021","1495","","specs/homepage.test.js","Homepage","","","Should display ""HelloWord"" text on page",""
"passed","Fri Nov 12 16:56:02 UTC 2021","Fri Nov 12 16:56:04 UTC 2021","1918","","specs/jetpack-boost/modules-common.test.js","Modules","","","The render-blocking-js module state should revert back to original state",""
"passed","Fri Nov 12 16:55:47 UTC 2021","Fri Nov 12 16:55:52 UTC 2021","4388","","specs/jetpack-boost/modules-common.test.js","Modules","","","The critical-css module state should revert back to original state",""
"passed","Fri Nov 12 16:55:52 UTC 2021","Fri Nov 12 16:55:54 UTC 2021","1848","","specs/jetpack-boost/modules-common.test.js","Modules","","","The lazy-images module should be enabled by default",""
"passed","Fri Nov 12 16:55:54 UTC 2021","Fri Nov 12 16:55:56 UTC 2021","2334","","specs/jetpack-boost/modules-common.test.js","Modules","","","The lazy-images module state should toggle to an inverse state",""
"passed","Fri Nov 12 16:55:42 UTC 2021","Fri Nov 12 16:55:45 UTC 2021","2735","","specs/jetpack-boost/modules-common.test.js","Modules","","","The critical-css module should be disabled by default",""
"passed","Fri Nov 12 16:55:56 UTC 2021","Fri Nov 12 16:55:58 UTC 2021","1985","","specs/jetpack-boost/modules-common.test.js","Modules","","","The lazy-images module state should revert back to original state",""
"passed","Fri Nov 12 16:55:45 UTC 2021","Fri Nov 12 16:55:47 UTC 2021","2310","","specs/jetpack-boost/modules-common.test.js","Modules","","","The critical-css module state should toggle to an inverse state",""
"passed","Fri Nov 12 16:56:04 UTC 2021","Fri Nov 12 16:56:06 UTC 2021","1703","","specs/jetpack-boost/speed-score.test.js","Speed Score feature","","","Should display a mobile and desktop speed score greater than zero",""
"skipped","Fri Nov 12 16:55:34 UTC 2021","Fri Nov 12 16:55:34 UTC 2021","0","","specs/homepage.test.js","Homepage","","","Should be ready",""
"passed","Fri Nov 12 16:55:33 UTC 2021","Fri Nov 12 16:55:34 UTC 2021","1194","","specs/homepage.test.js","Homepage","","","Should include the jetpack boost meta tag(s)",""
"passed","Fri Nov 12 16:55:58 UTC 2021","Fri Nov 12 16:56:00 UTC 2021","1554","","specs/jetpack-boost/modules-common.test.js","Modules","","","The render-blocking-js module should be disabled by default",""
"passed","Fri Nov 12 16:56:00 UTC 2021","Fri Nov 12 16:56:02 UTC 2021","2733","","specs/jetpack-boost/modules-common.test.js","Modules","","","The render-blocking-js module state should toggle to an inverse state",""
