"Status","Start Time","Stop Time","Duration in ms","Parent Suite","Suite","Sub Suite","Test Class","Test Method","Name","Description"
"passed","Tue Nov 23 14:31:43 UTC 2021","Tue Nov 23 14:31:45 UTC 2021","1406","","specs/jetpack-boost/modules-common.test.js","Modules","","","The lazy-images module should be enabled by default",""
"passed","Tue Nov 23 14:31:48 UTC 2021","Tue Nov 23 14:31:49 UTC 2021","1351","","specs/jetpack-boost/modules-common.test.js","Modules","","","The render-blocking-js module should be disabled by default",""
"passed","Tue Nov 23 14:31:26 UTC 2021","Tue Nov 23 14:31:27 UTC 2021","1088","","specs/homepage.test.js","Homepage","","","Should include the jetpack boost meta tag(s)",""
"passed","Tue Nov 23 14:31:23 UTC 2021","Tue Nov 23 14:31:26 UTC 2021","2367","","specs/homepage.test.js","Homepage","","","Should display ""HelloWord"" text on page",""
"passed","Tue Nov 23 14:31:40 UTC 2021","Tue Nov 23 14:31:43 UTC 2021","3271","","specs/jetpack-boost/modules-common.test.js","Modules","","","The critical-css module state should revert back to original state",""
"passed","Tue Nov 23 14:31:46 UTC 2021","Tue Nov 23 14:31:48 UTC 2021","1376","","specs/jetpack-boost/modules-common.test.js","Modules","","","The lazy-images module state should revert back to original state",""
"passed","Tue Nov 23 14:31:45 UTC 2021","Tue Nov 23 14:31:46 UTC 2021","1686","","specs/jetpack-boost/modules-common.test.js","Modules","","","The lazy-images module state should toggle to an inverse state",""
"passed","Tue Nov 23 14:31:49 UTC 2021","Tue Nov 23 14:31:51 UTC 2021","1574","","specs/jetpack-boost/modules-common.test.js","Modules","","","The render-blocking-js module state should toggle to an inverse state",""
"passed","Tue Nov 23 14:31:51 UTC 2021","Tue Nov 23 14:31:52 UTC 2021","1472","","specs/jetpack-boost/modules-common.test.js","Modules","","","The render-blocking-js module state should revert back to original state",""
"passed","Tue Nov 23 14:31:52 UTC 2021","Tue Nov 23 14:32:05 UTC 2021","12326","","specs/jetpack-boost/speed-score.test.js","Speed Score feature","","","Should display a mobile and desktop speed score greater than zero",""
"passed","Tue Nov 23 14:31:38 UTC 2021","Tue Nov 23 14:31:40 UTC 2021","1694","","specs/jetpack-boost/modules-common.test.js","Modules","","","The critical-css module state should toggle to an inverse state",""
"skipped","Tue Nov 23 14:31:27 UTC 2021","Tue Nov 23 14:31:27 UTC 2021","0","","specs/homepage.test.js","Homepage","","","Should be ready",""
"passed","Tue Nov 23 14:31:33 UTC 2021","Tue Nov 23 14:31:38 UTC 2021","4971","","specs/jetpack-boost/modules-common.test.js","Modules","","","The critical-css module should be disabled by default",""
