"Status","Start Time","Stop Time","Duration in ms","Parent Suite","Suite","Sub Suite","Test Class","Test Method","Name","Description"
"passed","Tue Dec 07 18:48:41 UTC 2021","Tue Dec 07 18:48:43 UTC 2021","1955","","specs/jetpack-boost/modules-common.test.js","Modules","","","The lazy-images module state should toggle to an inverse state",""
"passed","Tue Dec 07 18:48:49 UTC 2021","Tue Dec 07 18:48:52 UTC 2021","3040","","specs/jetpack-boost/modules-common.test.js","Modules","","","The render-blocking-js module state should revert back to original state",""
"passed","Tue Dec 07 18:48:40 UTC 2021","Tue Dec 07 18:48:41 UTC 2021","1670","","specs/jetpack-boost/modules-common.test.js","Modules","","","The lazy-images module should be disabled by default",""
"passed","Tue Dec 07 18:48:19 UTC 2021","Tue Dec 07 18:48:22 UTC 2021","2612","","specs/homepage.test.js","Homepage","","","Should display ""HelloWord"" text on page",""
"passed","Tue Dec 07 18:48:22 UTC 2021","Tue Dec 07 18:48:23 UTC 2021","1486","","specs/homepage.test.js","Homepage","","","Should include the jetpack boost meta tag(s)",""
"passed","Tue Dec 07 18:48:47 UTC 2021","Tue Dec 07 18:48:49 UTC 2021","1908","","specs/jetpack-boost/modules-common.test.js","Modules","","","The render-blocking-js module state should toggle to an inverse state",""
"passed","Tue Dec 07 18:48:45 UTC 2021","Tue Dec 07 18:48:47 UTC 2021","1816","","specs/jetpack-boost/modules-common.test.js","Modules","","","The render-blocking-js module should be disabled by default",""
"passed","Tue Dec 07 18:48:52 UTC 2021","Tue Dec 07 18:48:56 UTC 2021","3672","","specs/jetpack-boost/speed-score.test.js","Speed Score feature","","","Should display a mobile and desktop speed score greater than zero",""
"passed","Tue Dec 07 18:48:34 UTC 2021","Tue Dec 07 18:48:36 UTC 2021","2057","","specs/jetpack-boost/modules-common.test.js","Modules","","","The critical-css module state should toggle to an inverse state",""
"passed","Tue Dec 07 18:48:36 UTC 2021","Tue Dec 07 18:48:40 UTC 2021","3443","","specs/jetpack-boost/modules-common.test.js","Modules","","","The critical-css module state should revert back to original state",""
"passed","Tue Dec 07 18:48:43 UTC 2021","Tue Dec 07 18:48:45 UTC 2021","2089","","specs/jetpack-boost/modules-common.test.js","Modules","","","The lazy-images module state should revert back to original state",""
"skipped","Tue Dec 07 18:48:23 UTC 2021","Tue Dec 07 18:48:23 UTC 2021","0","","specs/homepage.test.js","Homepage","","","Should be ready",""
"passed","Tue Dec 07 18:48:32 UTC 2021","Tue Dec 07 18:48:34 UTC 2021","1998","","specs/jetpack-boost/modules-common.test.js","Modules","","","The critical-css module should be disabled by default",""
