"Status","Start Time","Stop Time","Duration in ms","Parent Suite","Suite","Sub Suite","Test Class","Test Method","Name","Description"
"passed","Thu Jan 20 03:46:00 UTC 2022","Thu Jan 20 03:46:06 UTC 2022","6079","","specs/common.test.js","","","","Click on the plugins page should navigate to Boost settings page",""
"passed","Thu Jan 20 03:47:46 UTC 2022","Thu Jan 20 03:47:49 UTC 2022","2450","","specs/critical-css.test.js","Critical CSS module","","","User can access the Critical advanced recommendations and go back to settings page",""
"passed","Thu Jan 20 03:50:11 UTC 2022","Thu Jan 20 03:50:29 UTC 2022","17429","","specs/speed-score.test.js","Speed Score feature","","","The Speed Score section should display a mobile and desktop speed score greater than zero",""
"passed","Thu Jan 20 03:49:03 UTC 2022","Thu Jan 20 03:49:03 UTC 2022","332","","specs/modules-common.test.js","Modules","","","The render-blocking-js module state should toggle to an inverse state",""
"passed","Thu Jan 20 03:49:07 UTC 2022","Thu Jan 20 03:49:10 UTC 2022","3138","","specs/render-blocking-js.test.js","Render Blocking JS module","","","JavaScript on a post should be at its original position in the document when the module is inactive",""
"passed","Thu Jan 20 03:50:07 UTC 2022","Thu Jan 20 03:50:11 UTC 2022","3916","","specs/score-auto-refresh.test.js","Auto refresh of speed scores","","","Score refresh should debounce between multiple module toggle",""
"passed","Thu Jan 20 03:48:02 UTC 2022","Thu Jan 20 03:48:07 UTC 2022","5276","","specs/jetpack-compatibility.test.js","Jetpack compatibility","","","The Jetpack lazy-image module deactivation reflects in Boost dashboard",""
"passed","Thu Jan 20 03:49:01 UTC 2022","Thu Jan 20 03:49:01 UTC 2022","408","","specs/modules-common.test.js","Modules","","","The critical-css module state should revert back to original state",""
"passed","Thu Jan 20 03:47:01 UTC 2022","Thu Jan 20 03:47:04 UTC 2022","2463","","specs/critical-css.test.js","Critical CSS module","","","No Critical CSS meta information should show on the admin when the module is inactive",""
"passed","Thu Jan 20 03:46:10 UTC 2022","Thu Jan 20 03:46:32 UTC 2022","22055","","specs/common.test.js","","","","Deactivating the plugin should clear Critical CSS and Dismissed Recommendation notice option",""
"passed","Thu Jan 20 03:49:01 UTC 2022","Thu Jan 20 03:49:01 UTC 2022","63","","specs/modules-common.test.js","Modules","","","The lazy-images module should be disabled by default",""
"passed","Thu Jan 20 03:48:07 UTC 2022","Thu Jan 20 03:48:13 UTC 2022","5738","","specs/jetpack-compatibility.test.js","Jetpack compatibility","","","The Boost lazy-image module activation reflects in Jetpack dashboard",""
"passed","Thu Jan 20 03:46:06 UTC 2022","Thu Jan 20 03:46:10 UTC 2022","3663","","specs/common.test.js","","","","Click on the sidebar Boost Jetpack submenu should navigate to Boost settings page",""
"passed","Thu Jan 20 03:49:02 UTC 2022","Thu Jan 20 03:49:02 UTC 2022","474","","specs/modules-common.test.js","Modules","","","The lazy-images module state should revert back to original state",""
"passed","Thu Jan 20 03:49:01 UTC 2022","Thu Jan 20 03:49:01 UTC 2022","440","","specs/modules-common.test.js","Modules","","","The critical-css module state should toggle to an inverse state",""
"passed","Thu Jan 20 03:49:02 UTC 2022","Thu Jan 20 03:49:03 UTC 2022","58","","specs/modules-common.test.js","Modules","","","The render-blocking-js module should be disabled by default",""
"passed","Thu Jan 20 03:49:21 UTC 2022","Thu Jan 20 03:49:49 UTC 2022","28776","","specs/score-auto-refresh.test.js","Auto refresh of speed scores","","","Enabling lazy-images should refresh scores",""
"passed","Thu Jan 20 03:47:19 UTC 2022","Thu Jan 20 03:47:32 UTC 2022","12996","","specs/critical-css.test.js","Critical CSS module","","","Critical CSS Admin message should show when the theme is changed",""
"passed","Thu Jan 20 03:49:10 UTC 2022","Thu Jan 20 03:49:12 UTC 2022","2515","","specs/render-blocking-js.test.js","Render Blocking JS module","","","JavaScript on a post should be pushed at the bottom of the document when the module is active",""
"passed","Thu Jan 20 03:49:01 UTC 2022","Thu Jan 20 03:49:02 UTC 2022","548","","specs/modules-common.test.js","Modules","","","The lazy-images module state should toggle to an inverse state",""
"passed","Thu Jan 20 03:47:15 UTC 2022","Thu Jan 20 03:47:18 UTC 2022","3759","","specs/critical-css.test.js","Critical CSS module","","","Critical CSS meta information should show on the admin when the module is re-activated",""
"passed","Thu Jan 20 03:46:35 UTC 2022","Thu Jan 20 03:46:44 UTC 2022","8408","","specs/connection.test.js","Settings Page Connection","","","Should connect to WP.com on a fresh install with Jetpack plugin activated and Jetpack already connected",""
"passed","Thu Jan 20 03:48:13 UTC 2022","Thu Jan 20 03:48:18 UTC 2022","5810","","specs/jetpack-compatibility.test.js","Jetpack compatibility","","","The Boost lazy-image module deactivation reflects in Jetpack dashboard",""
"passed","Thu Jan 20 03:50:29 UTC 2022","Thu Jan 20 03:50:41 UTC 2022","12414","","specs/speed-score.test.js","Speed Score feature","","","The Speed Scores should be able to refresh",""
"passed","Thu Jan 20 03:48:23 UTC 2022","Thu Jan 20 03:48:26 UTC 2022","2625","","specs/lazy-images.test.js","Lazy Images module","","","Images on a post should not be lazy loaded when the module is inactive",""
"passed","Thu Jan 20 03:48:26 UTC 2022","Thu Jan 20 03:48:29 UTC 2022","2726","","specs/lazy-images.test.js","Lazy Images module","","","Images on a post should be lazy loaded when the module is active",""
"passed","Thu Jan 20 03:47:18 UTC 2022","Thu Jan 20 03:47:19 UTC 2022","351","","specs/critical-css.test.js","Critical CSS module","","","Critical CSS should be available on the frontend when the module is active",""
"passed","Thu Jan 20 03:47:32 UTC 2022","Thu Jan 20 03:47:46 UTC 2022","14781","","specs/critical-css.test.js","Critical CSS module","","","Critical CSS should be generated with an error (advanced recommendations)",""
"passed","Thu Jan 20 03:50:41 UTC 2022","Thu Jan 20 03:50:43 UTC 2022","1672","","specs/speed-score.test.js","Speed Score feature","","","Should be able to hover info icon next to overall score and see the detailed overall score description popin",""
"passed","Thu Jan 20 03:47:56 UTC 2022","Thu Jan 20 03:48:02 UTC 2022","5796","","specs/jetpack-compatibility.test.js","Jetpack compatibility","","","The Jetpack lazy-image module activation reflects in Boost dashboard",""
"passed","Thu Jan 20 03:47:06 UTC 2022","Thu Jan 20 03:47:15 UTC 2022","8835","","specs/critical-css.test.js","Critical CSS module","","","Critical CSS should be generated when the module is active",""
"passed","Thu Jan 20 03:46:44 UTC 2022","Thu Jan 20 03:46:51 UTC 2022","7080","","specs/connection.test.js","Settings Page Connection","","","Should connect to WP.com on a fresh install with Jetpack plugin activated",""
"passed","Thu Jan 20 03:49:49 UTC 2022","Thu Jan 20 03:50:07 UTC 2022","18096","","specs/score-auto-refresh.test.js","Auto refresh of speed scores","","","Enabling render-blocking-js should refresh scores",""
"passed","Thu Jan 20 03:49:00 UTC 2022","Thu Jan 20 03:49:01 UTC 2022","99","","specs/modules-common.test.js","Modules","","","The critical-css module should be disabled by default",""
"passed","Thu Jan 20 03:47:04 UTC 2022","Thu Jan 20 03:47:06 UTC 2022","2073","","specs/critical-css.test.js","Critical CSS module","","","No Critical CSS should be available on the frontend when the module is inactive",""
"passed","Thu Jan 20 03:46:51 UTC 2022","Thu Jan 20 03:46:58 UTC 2022","7228","","specs/connection.test.js","Settings Page Connection","","","Should connect to WP.com on a fresh install without Jetpack plugin activated",""
"passed","Thu Jan 20 03:49:03 UTC 2022","Thu Jan 20 03:49:03 UTC 2022","318","","specs/modules-common.test.js","Modules","","","The render-blocking-js module state should revert back to original state",""
