"Status","Start Time","Stop Time","Duration in ms","Parent Suite","Suite","Sub Suite","Test Class","Test Method","Name","Description"
"passed","Fri Dec 10 00:24:23 UTC 2021","Fri Dec 10 00:24:25 UTC 2021","1751","","specs/jetpack-boost/modules-common.test.js","Modules","","","The render-blocking-js module state should revert back to original state",""
"passed","Fri Dec 10 00:23:57 UTC 2021","Fri Dec 10 00:23:59 UTC 2021","2508","","specs/jetpack-boost/modules-common.test.js","Modules","","","The critical-css module state should revert back to original state",""
"passed","Fri Dec 10 00:23:59 UTC 2021","Fri Dec 10 00:24:01 UTC 2021","1464","","specs/jetpack-boost/modules-common.test.js","Modules","","","The lazy-images module should be disabled by default",""
"passed","Fri Dec 10 00:23:53 UTC 2021","Fri Dec 10 00:23:55 UTC 2021","1736","","specs/jetpack-boost/modules-common.test.js","Modules","","","The critical-css module should be disabled by default",""
"passed","Fri Dec 10 00:23:55 UTC 2021","Fri Dec 10 00:23:57 UTC 2021","1878","","specs/jetpack-boost/modules-common.test.js","Modules","","","The critical-css module state should toggle to an inverse state",""
"passed","Fri Dec 10 00:24:22 UTC 2021","Fri Dec 10 00:24:23 UTC 2021","1796","","specs/jetpack-boost/modules-common.test.js","Modules","","","The render-blocking-js module state should toggle to an inverse state",""
"passed","Fri Dec 10 00:24:20 UTC 2021","Fri Dec 10 00:24:22 UTC 2021","1699","","specs/jetpack-boost/modules-common.test.js","Modules","","","The render-blocking-js module should be disabled by default",""
"passed","Fri Dec 10 00:23:44 UTC 2021","Fri Dec 10 00:23:45 UTC 2021","1773","","specs/homepage.test.js","Homepage","","","Should display ""HelloWord"" text on page",""
"passed","Fri Dec 10 00:23:45 UTC 2021","Fri Dec 10 00:23:47 UTC 2021","1368","","specs/homepage.test.js","Homepage","","","Should include the jetpack boost meta tag(s)",""
"passed","Fri Dec 10 00:24:03 UTC 2021","Fri Dec 10 00:24:05 UTC 2021","2095","","specs/jetpack-boost/speed-score.test.js","Speed Score feature","","","Should display a mobile and desktop speed score greater than zero",""
"skipped","Fri Dec 10 00:23:47 UTC 2021","Fri Dec 10 00:23:47 UTC 2021","0","","specs/homepage.test.js","Homepage","","","Should be ready",""
"failed","Fri Dec 10 00:24:01 UTC 2021","Fri Dec 10 00:24:02 UTC 2021","1546","","specs/jetpack-boost/modules-common.test.js","Modules","","","The lazy-images module state should toggle to an inverse state",""
"failed","Fri Dec 10 00:24:11 UTC 2021","Fri Dec 10 00:24:13 UTC 2021","1851","","specs/jetpack-boost/modules-common.test.js","Modules","","","The lazy-images module state should revert back to original state",""
