"Status","Start Time","Stop Time","Duration in ms","Parent Suite","Suite","Sub Suite","Test Class","Test Method","Name","Description"
"passed","Wed Dec 15 15:59:55 UTC 2021","Wed Dec 15 15:59:56 UTC 2021","1784","","specs/homepage.test.js","Homepage","","","Should display ""HelloWord"" text on page",""
"passed","Wed Dec 15 16:00:18 UTC 2021","Wed Dec 15 16:00:20 UTC 2021","2132","","specs/jetpack-boost/modules-common.test.js","Modules","","","The lazy-images module state should toggle to an inverse state",""
"passed","Wed Dec 15 16:00:06 UTC 2021","Wed Dec 15 16:00:07 UTC 2021","1564","","specs/jetpack-boost/modules-common.test.js","Modules","","","The critical-css module should be disabled by default",""
"passed","Wed Dec 15 16:00:26 UTC 2021","Wed Dec 15 16:00:28 UTC 2021","2063","","specs/jetpack-boost/modules-common.test.js","Modules","","","The render-blocking-js module state should revert back to original state",""
"passed","Wed Dec 15 16:00:07 UTC 2021","Wed Dec 15 16:00:10 UTC 2021","2141","","specs/jetpack-boost/modules-common.test.js","Modules","","","The critical-css module state should toggle to an inverse state",""
"passed","Wed Dec 15 15:59:56 UTC 2021","Wed Dec 15 15:59:58 UTC 2021","1134","","specs/homepage.test.js","Homepage","","","Should include the jetpack boost meta tag(s)",""
"passed","Wed Dec 15 16:00:28 UTC 2021","Wed Dec 15 16:00:30 UTC 2021","2181","","specs/jetpack-boost/speed-score.test.js","Speed Score feature","","","Should display a mobile and desktop speed score greater than zero",""
"passed","Wed Dec 15 16:00:17 UTC 2021","Wed Dec 15 16:00:18 UTC 2021","1571","","specs/jetpack-boost/modules-common.test.js","Modules","","","The lazy-images module should be disabled by default",""
"passed","Wed Dec 15 16:00:24 UTC 2021","Wed Dec 15 16:00:26 UTC 2021","1966","","specs/jetpack-boost/modules-common.test.js","Modules","","","The render-blocking-js module state should toggle to an inverse state",""
"skipped","Wed Dec 15 15:59:58 UTC 2021","Wed Dec 15 15:59:58 UTC 2021","0","","specs/homepage.test.js","Homepage","","","Should be ready",""
"passed","Wed Dec 15 16:00:10 UTC 2021","Wed Dec 15 16:00:17 UTC 2021","7008","","specs/jetpack-boost/modules-common.test.js","Modules","","","The critical-css module state should revert back to original state",""
"passed","Wed Dec 15 16:00:22 UTC 2021","Wed Dec 15 16:00:24 UTC 2021","1797","","specs/jetpack-boost/modules-common.test.js","Modules","","","The render-blocking-js module should be disabled by default",""
"passed","Wed Dec 15 16:00:20 UTC 2021","Wed Dec 15 16:00:22 UTC 2021","1989","","specs/jetpack-boost/modules-common.test.js","Modules","","","The lazy-images module state should revert back to original state",""
