"Status","Start Time","Stop Time","Duration in ms","Parent Suite","Suite","Sub Suite","Test Class","Test Method","Name","Description"
"passed","Fri Dec 03 02:35:59 UTC 2021","Fri Dec 03 02:36:12 UTC 2021","12322","","specs/jetpack-boost/connection.test.js","Settings Page","","","Should connect to WP.com on a fresh install with Jetpack plugin activated and Jetpack already connected",""
"passed","Fri Dec 03 02:37:11 UTC 2021","Fri Dec 03 02:37:12 UTC 2021","503","","specs/jetpack-boost/modules-common.test.js","Modules","","","The critical-css module state should toggle to an inverse state",""
"passed","Fri Dec 03 02:37:25 UTC 2021","Fri Dec 03 02:37:31 UTC 2021","6179","","specs/jetpack-boost/render-blocking-js.test.js","Render Blocking JS module","","","JavaScript on a post should be pushed at the bottom of the document when the module is active",""
"skipped","Fri Dec 03 02:35:59 UTC 2021","Fri Dec 03 02:35:59 UTC 2021","0","","specs/homepage.test.js","Homepage","","","Should be ready",""
"passed","Fri Dec 03 02:36:22 UTC 2021","Fri Dec 03 02:36:36 UTC 2021","13296","","specs/jetpack-boost/connection.test.js","Settings Page","","","Should connect to WP.com on a fresh install without Jetpack plugin activated",""
"passed","Fri Dec 03 02:37:19 UTC 2021","Fri Dec 03 02:37:25 UTC 2021","5878","","specs/jetpack-boost/render-blocking-js.test.js","Render Blocking JS module","","","JavaScript on a post should be at its original position in the document when the module is inactive",""
"passed","Fri Dec 03 02:37:12 UTC 2021","Fri Dec 03 02:37:12 UTC 2021","439","","specs/jetpack-boost/modules-common.test.js","Modules","","","The critical-css module state should revert back to original state",""
"passed","Fri Dec 03 02:35:44 UTC 2021","Fri Dec 03 02:35:59 UTC 2021","14976","","specs/homepage.test.js","Homepage","","","Should include the jetpack boost meta tag(s)",""
"passed","Fri Dec 03 02:36:52 UTC 2021","Fri Dec 03 02:36:57 UTC 2021","5058","","specs/jetpack-boost/lazy-images.test.js","Lazy Images module","","","Images on a post should be Lazy loaded when the module is active",""
"passed","Fri Dec 03 02:37:12 UTC 2021","Fri Dec 03 02:37:12 UTC 2021","53","","specs/jetpack-boost/modules-common.test.js","Modules","","","The lazy-images module should be disabled by default",""
"passed","Fri Dec 03 02:37:13 UTC 2021","Fri Dec 03 02:37:14 UTC 2021","418","","specs/jetpack-boost/modules-common.test.js","Modules","","","The render-blocking-js module state should toggle to an inverse state",""
"passed","Fri Dec 03 02:37:13 UTC 2021","Fri Dec 03 02:37:13 UTC 2021","404","","specs/jetpack-boost/modules-common.test.js","Modules","","","The lazy-images module state should revert back to original state",""
"passed","Fri Dec 03 02:36:12 UTC 2021","Fri Dec 03 02:36:22 UTC 2021","10561","","specs/jetpack-boost/connection.test.js","Settings Page","","","Should connect to WP.com on a fresh install with Jetpack plugin activated",""
"passed","Fri Dec 03 02:37:14 UTC 2021","Fri Dec 03 02:37:14 UTC 2021","467","","specs/jetpack-boost/modules-common.test.js","Modules","","","The render-blocking-js module state should revert back to original state",""
"passed","Fri Dec 03 02:36:47 UTC 2021","Fri Dec 03 02:36:52 UTC 2021","5553","","specs/jetpack-boost/lazy-images.test.js","Lazy Images module","","","Images on a post should not be Lazy loaded when the module is inactive",""
"passed","Fri Dec 03 02:37:12 UTC 2021","Fri Dec 03 02:37:13 UTC 2021","461","","specs/jetpack-boost/modules-common.test.js","Modules","","","The lazy-images module state should toggle to an inverse state",""
"passed","Fri Dec 03 02:35:42 UTC 2021","Fri Dec 03 02:35:44 UTC 2021","1626","","specs/homepage.test.js","Homepage","","","Should display ""HelloWord"" text on page",""
"passed","Fri Dec 03 02:37:31 UTC 2021","Fri Dec 03 02:37:33 UTC 2021","1942","","specs/jetpack-boost/speed-score.test.js","Speed Score feature","","","Should display a mobile and desktop speed score greater than zero",""
"passed","Fri Dec 03 02:37:11 UTC 2021","Fri Dec 03 02:37:11 UTC 2021","78","","specs/jetpack-boost/modules-common.test.js","Modules","","","The critical-css module should be disabled by default",""
"passed","Fri Dec 03 02:37:13 UTC 2021","Fri Dec 03 02:37:13 UTC 2021","48","","specs/jetpack-boost/modules-common.test.js","Modules","","","The render-blocking-js module should be disabled by default",""
