"Status","Start Time","Stop Time","Duration in ms","Parent Suite","Suite","Sub Suite","Test Class","Test Method","Name","Description"
"passed","Tue Dec 14 14:04:29 UTC 2021","Tue Dec 14 14:04:54 UTC 2021","24884","","specs/critical-css.test.js","Critical CSS module","","","Critical CSS should be generated with an error (advanced recommendations)",""
"passed","Tue Dec 14 14:05:16 UTC 2021","Tue Dec 14 14:05:20 UTC 2021","3441","","specs/lazy-images.test.js","Lazy Images module","","","Images on a post should be lazy loaded when the module is active",""
"passed","Tue Dec 14 14:05:38 UTC 2021","Tue Dec 14 14:05:39 UTC 2021","401","","specs/modules-common.test.js","Modules","","","The render-blocking-js module state should toggle to an inverse state",""
"passed","Tue Dec 14 14:04:09 UTC 2021","Tue Dec 14 14:04:09 UTC 2021","534","","specs/critical-css.test.js","Critical CSS module","","","Critical CSS should be available on the frontend when the module is active",""
"passed","Tue Dec 14 14:05:37 UTC 2021","Tue Dec 14 14:05:37 UTC 2021","460","","specs/modules-common.test.js","Modules","","","The critical-css module state should revert back to original state",""
"passed","Tue Dec 14 14:04:54 UTC 2021","Tue Dec 14 14:04:59 UTC 2021","4915","","specs/critical-css.test.js","Critical CSS module","","","User can access the Critical advanced recommendations and go back to settings page",""
"passed","Tue Dec 14 14:03:07 UTC 2021","Tue Dec 14 14:03:16 UTC 2021","9326","","specs/connection.test.js","Settings Page Connection","","","Should connect to WP.com on a fresh install with Jetpack plugin activated and Jetpack already connected",""
"passed","Tue Dec 14 14:05:36 UTC 2021","Tue Dec 14 14:05:36 UTC 2021","85","","specs/modules-common.test.js","Modules","","","The critical-css module should be disabled by default",""
"passed","Tue Dec 14 14:05:36 UTC 2021","Tue Dec 14 14:05:37 UTC 2021","484","","specs/modules-common.test.js","Modules","","","The critical-css module state should toggle to an inverse state",""
"passed","Tue Dec 14 14:05:13 UTC 2021","Tue Dec 14 14:05:16 UTC 2021","3706","","specs/lazy-images.test.js","Lazy Images module","","","Images on a post should not be lazy loaded when the module is inactive",""
"passed","Tue Dec 14 14:03:42 UTC 2021","Tue Dec 14 14:03:46 UTC 2021","3591","","specs/critical-css.test.js","Critical CSS module","","","No Critical CSS meta information should show on the admin when the module is inactive",""
"passed","Tue Dec 14 14:05:38 UTC 2021","Tue Dec 14 14:05:38 UTC 2021","48","","specs/modules-common.test.js","Modules","","","The render-blocking-js module should be disabled by default",""
"passed","Tue Dec 14 14:03:50 UTC 2021","Tue Dec 14 14:04:03 UTC 2021","12674","","specs/critical-css.test.js","Critical CSS module","","","Critical CSS should be generated when the module is active",""
"passed","Tue Dec 14 14:05:50 UTC 2021","Tue Dec 14 14:05:58 UTC 2021","7609","","specs/speed-score.test.js","Speed Score feature","","","The Speed Score section should display a mobile and desktop speed score greater than zero",""
"passed","Tue Dec 14 14:05:38 UTC 2021","Tue Dec 14 14:05:38 UTC 2021","462","","specs/modules-common.test.js","Modules","","","The lazy-images module state should revert back to original state",""
"passed","Tue Dec 14 14:05:37 UTC 2021","Tue Dec 14 14:05:37 UTC 2021","61","","specs/modules-common.test.js","Modules","","","The lazy-images module should be disabled by default",""
"passed","Tue Dec 14 14:05:47 UTC 2021","Tue Dec 14 14:05:50 UTC 2021","3003","","specs/render-blocking-js.test.js","Render Blocking JS module","","","JavaScript on a post should be pushed at the bottom of the document when the module is active",""
"passed","Tue Dec 14 14:05:43 UTC 2021","Tue Dec 14 14:05:47 UTC 2021","4001","","specs/render-blocking-js.test.js","Render Blocking JS module","","","JavaScript on a post should be at its original position in the document when the module is inactive",""
"passed","Tue Dec 14 14:02:24 UTC 2021","Tue Dec 14 14:03:01 UTC 2021","37282","","specs/common.test.js","","","","Deactivating the plugin should clear Critical CSS and Dismissed Recommendation notice option",""
"passed","Tue Dec 14 14:02:09 UTC 2021","Tue Dec 14 14:02:18 UTC 2021","9164","","specs/common.test.js","","","","Click on the plugins page should navigate to Boost settings page",""
"passed","Tue Dec 14 14:05:37 UTC 2021","Tue Dec 14 14:05:38 UTC 2021","431","","specs/modules-common.test.js","Modules","","","The lazy-images module state should toggle to an inverse state",""
"passed","Tue Dec 14 14:04:03 UTC 2021","Tue Dec 14 14:04:09 UTC 2021","5554","","specs/critical-css.test.js","Critical CSS module","","","Critical CSS meta information should show on the admin when the module is re-activated",""
"passed","Tue Dec 14 14:03:46 UTC 2021","Tue Dec 14 14:03:50 UTC 2021","4374","","specs/critical-css.test.js","Critical CSS module","","","No Critical CSS should be available on the frontend when the module is inactive",""
"passed","Tue Dec 14 14:04:09 UTC 2021","Tue Dec 14 14:04:29 UTC 2021","19657","","specs/critical-css.test.js","Critical CSS module","","","Critical CSS Admin message should show when the theme is changed",""
"passed","Tue Dec 14 14:03:26 UTC 2021","Tue Dec 14 14:03:38 UTC 2021","12411","","specs/connection.test.js","Settings Page Connection","","","Should connect to WP.com on a fresh install without Jetpack plugin activated",""
"passed","Tue Dec 14 14:05:39 UTC 2021","Tue Dec 14 14:05:39 UTC 2021","416","","specs/modules-common.test.js","Modules","","","The render-blocking-js module state should revert back to original state",""
"passed","Tue Dec 14 14:02:18 UTC 2021","Tue Dec 14 14:02:24 UTC 2021","5936","","specs/common.test.js","","","","Click on the sidebar Boost Jetpack submenu should navigate to Boost settings page",""
"passed","Tue Dec 14 14:03:16 UTC 2021","Tue Dec 14 14:03:26 UTC 2021","9340","","specs/connection.test.js","Settings Page Connection","","","Should connect to WP.com on a fresh install with Jetpack plugin activated",""
