"Status","Start Time","Stop Time","Duration in ms","Parent Suite","Suite","Sub Suite","Test Class","Test Method","Name","Description"
"passed","Fri Nov 26 03:08:28 UTC 2021","Fri Nov 26 03:08:30 UTC 2021","2246","","specs/homepage.test.js","Homepage","","","Should display ""HelloWord"" text on page",""
"passed","Fri Nov 26 03:08:30 UTC 2021","Fri Nov 26 03:08:31 UTC 2021","1163","","specs/homepage.test.js","Homepage","","","Should include the jetpack boost meta tag(s)",""
"passed","Fri Nov 26 03:08:38 UTC 2021","Fri Nov 26 03:08:40 UTC 2021","1937","","specs/jetpack-boost/modules-common.test.js","Modules","","","The critical-css module should be disabled by default",""
"passed","Fri Nov 26 03:08:53 UTC 2021","Fri Nov 26 03:08:55 UTC 2021","1870","","specs/jetpack-boost/modules-common.test.js","Modules","","","The render-blocking-js module state should toggle to an inverse state",""
"passed","Fri Nov 26 03:08:42 UTC 2021","Fri Nov 26 03:08:45 UTC 2021","3139","","specs/jetpack-boost/modules-common.test.js","Modules","","","The critical-css module state should revert back to original state",""
"passed","Fri Nov 26 03:08:50 UTC 2021","Fri Nov 26 03:08:52 UTC 2021","1715","","specs/jetpack-boost/modules-common.test.js","Modules","","","The lazy-images module state should revert back to original state",""
"passed","Fri Nov 26 03:08:45 UTC 2021","Fri Nov 26 03:08:49 UTC 2021","3313","","specs/jetpack-boost/modules-common.test.js","Modules","","","The lazy-images module should be enabled by default",""
"passed","Fri Nov 26 03:08:40 UTC 2021","Fri Nov 26 03:08:42 UTC 2021","2241","","specs/jetpack-boost/modules-common.test.js","Modules","","","The critical-css module state should toggle to an inverse state",""
"passed","Fri Nov 26 03:08:55 UTC 2021","Fri Nov 26 03:08:57 UTC 2021","1915","","specs/jetpack-boost/modules-common.test.js","Modules","","","The render-blocking-js module state should revert back to original state",""
"passed","Fri Nov 26 03:08:49 UTC 2021","Fri Nov 26 03:08:50 UTC 2021","1595","","specs/jetpack-boost/modules-common.test.js","Modules","","","The lazy-images module state should toggle to an inverse state",""
"passed","Fri Nov 26 03:08:52 UTC 2021","Fri Nov 26 03:08:53 UTC 2021","1486","","specs/jetpack-boost/modules-common.test.js","Modules","","","The render-blocking-js module should be disabled by default",""
"skipped","Fri Nov 26 03:08:31 UTC 2021","Fri Nov 26 03:08:31 UTC 2021","0","","specs/homepage.test.js","Homepage","","","Should be ready",""
"passed","Fri Nov 26 03:08:57 UTC 2021","Fri Nov 26 03:08:59 UTC 2021","2265","","specs/jetpack-boost/speed-score.test.js","Speed Score feature","","","Should display a mobile and desktop speed score greater than zero",""
