"Status","Start Time","Stop Time","Duration in ms","Parent Suite","Suite","Sub Suite","Test Class","Test Method","Name","Description"
"passed","Sun Dec 12 02:15:24 UTC 2021","Sun Dec 12 02:15:26 UTC 2021","2084","","specs/jetpack-boost/modules-common.test.js","Modules","","","The lazy-images module state should revert back to original state",""
"passed","Sun Dec 12 02:15:22 UTC 2021","Sun Dec 12 02:15:24 UTC 2021","2058","","specs/jetpack-boost/modules-common.test.js","Modules","","","The lazy-images module state should toggle to an inverse state",""
"passed","Sun Dec 12 02:14:59 UTC 2021","Sun Dec 12 02:15:01 UTC 2021","2287","","specs/homepage.test.js","Homepage","","","Should display ""HelloWord"" text on page",""
"passed","Sun Dec 12 02:15:20 UTC 2021","Sun Dec 12 02:15:22 UTC 2021","1862","","specs/jetpack-boost/modules-common.test.js","Modules","","","The lazy-images module should be disabled by default",""
"passed","Sun Dec 12 02:15:30 UTC 2021","Sun Dec 12 02:15:32 UTC 2021","2061","","specs/jetpack-boost/modules-common.test.js","Modules","","","The render-blocking-js module state should revert back to original state",""
"passed","Sun Dec 12 02:15:12 UTC 2021","Sun Dec 12 02:15:14 UTC 2021","2407","","specs/jetpack-boost/modules-common.test.js","Modules","","","The critical-css module should be disabled by default",""
"skipped","Sun Dec 12 02:15:03 UTC 2021","Sun Dec 12 02:15:03 UTC 2021","0","","specs/homepage.test.js","Homepage","","","Should be ready",""
"passed","Sun Dec 12 02:15:14 UTC 2021","Sun Dec 12 02:15:17 UTC 2021","2804","","specs/jetpack-boost/modules-common.test.js","Modules","","","The critical-css module state should toggle to an inverse state",""
"passed","Sun Dec 12 02:15:28 UTC 2021","Sun Dec 12 02:15:30 UTC 2021","1956","","specs/jetpack-boost/modules-common.test.js","Modules","","","The render-blocking-js module state should toggle to an inverse state",""
"passed","Sun Dec 12 02:15:17 UTC 2021","Sun Dec 12 02:15:20 UTC 2021","3489","","specs/jetpack-boost/modules-common.test.js","Modules","","","The critical-css module state should revert back to original state",""
"passed","Sun Dec 12 02:15:01 UTC 2021","Sun Dec 12 02:15:03 UTC 2021","1429","","specs/homepage.test.js","Homepage","","","Should include the jetpack boost meta tag(s)",""
"passed","Sun Dec 12 02:15:32 UTC 2021","Sun Dec 12 02:15:34 UTC 2021","1865","","specs/jetpack-boost/speed-score.test.js","Speed Score feature","","","Should display a mobile and desktop speed score greater than zero",""
"passed","Sun Dec 12 02:15:26 UTC 2021","Sun Dec 12 02:15:28 UTC 2021","1646","","specs/jetpack-boost/modules-common.test.js","Modules","","","The render-blocking-js module should be disabled by default",""
