"Status","Start Time","Stop Time","Duration in ms","Parent Suite","Suite","Sub Suite","Test Class","Test Method","Name","Description"
"passed","Thu Dec 02 20:51:31 UTC 2021","Thu Dec 02 20:51:32 UTC 2021","1744","","specs/jetpack-boost/modules-common.test.js","Modules","","","The render-blocking-js module should be disabled by default",""
"failed","Thu Dec 02 20:51:09 UTC 2021","Thu Dec 02 20:51:10 UTC 2021","1474","","specs/jetpack-boost/modules-common.test.js","Modules","","","The lazy-images module state should toggle to an inverse state",""
"passed","Thu Dec 02 20:51:07 UTC 2021","Thu Dec 02 20:51:09 UTC 2021","1371","","specs/jetpack-boost/modules-common.test.js","Modules","","","The lazy-images module should be disabled by default",""
"passed","Thu Dec 02 20:51:34 UTC 2021","Thu Dec 02 20:51:36 UTC 2021","1592","","specs/jetpack-boost/modules-common.test.js","Modules","","","The render-blocking-js module state should revert back to original state",""
"passed","Thu Dec 02 20:51:01 UTC 2021","Thu Dec 02 20:51:02 UTC 2021","1351","","specs/jetpack-boost/modules-common.test.js","Modules","","","The critical-css module should be disabled by default",""
"passed","Thu Dec 02 20:50:51 UTC 2021","Thu Dec 02 20:50:53 UTC 2021","2058","","specs/homepage.test.js","Homepage","","","Should display ""HelloWord"" text on page",""
"skipped","Thu Dec 02 20:50:54 UTC 2021","Thu Dec 02 20:50:54 UTC 2021","0","","specs/homepage.test.js","Homepage","","","Should be ready",""
"failed","Thu Dec 02 20:51:21 UTC 2021","Thu Dec 02 20:51:23 UTC 2021","1694","","specs/jetpack-boost/modules-common.test.js","Modules","","","The lazy-images module state should revert back to original state",""
"passed","Thu Dec 02 20:51:04 UTC 2021","Thu Dec 02 20:51:07 UTC 2021","3036","","specs/jetpack-boost/modules-common.test.js","Modules","","","The critical-css module state should revert back to original state",""
"passed","Thu Dec 02 20:50:53 UTC 2021","Thu Dec 02 20:50:54 UTC 2021","1596","","specs/homepage.test.js","Homepage","","","Should include the jetpack boost meta tag(s)",""
"passed","Thu Dec 02 20:51:32 UTC 2021","Thu Dec 02 20:51:34 UTC 2021","1766","","specs/jetpack-boost/modules-common.test.js","Modules","","","The render-blocking-js module state should toggle to an inverse state",""
"passed","Thu Dec 02 20:51:02 UTC 2021","Thu Dec 02 20:51:04 UTC 2021","1998","","specs/jetpack-boost/modules-common.test.js","Modules","","","The critical-css module state should toggle to an inverse state",""
"passed","Thu Dec 02 20:51:11 UTC 2021","Thu Dec 02 20:51:13 UTC 2021","2486","","specs/jetpack-boost/speed-score.test.js","Speed Score feature","","","Should display a mobile and desktop speed score greater than zero",""
