"Status","Start Time","Stop Time","Duration in ms","Parent Suite","Suite","Sub Suite","Test Class","Test Method","Name","Description"
"skipped","Wed Dec 15 21:32:54 UTC 2021","Wed Dec 15 21:32:54 UTC 2021","0","","specs/homepage.test.js","Homepage","","","Should be ready",""
"passed","Wed Dec 15 21:33:10 UTC 2021","Wed Dec 15 21:33:11 UTC 2021","1519","","specs/jetpack-boost/modules-common.test.js","Modules","","","The lazy-images module should be disabled by default",""
"passed","Wed Dec 15 21:33:01 UTC 2021","Wed Dec 15 21:33:04 UTC 2021","2427","","specs/jetpack-boost/modules-common.test.js","Modules","","","The critical-css module should be disabled by default",""
"passed","Wed Dec 15 21:33:04 UTC 2021","Wed Dec 15 21:33:06 UTC 2021","2409","","specs/jetpack-boost/modules-common.test.js","Modules","","","The critical-css module state should toggle to an inverse state",""
"passed","Wed Dec 15 21:32:53 UTC 2021","Wed Dec 15 21:32:54 UTC 2021","1261","","specs/homepage.test.js","Homepage","","","Should include the jetpack boost meta tag(s)",""
"passed","Wed Dec 15 21:33:13 UTC 2021","Wed Dec 15 21:33:15 UTC 2021","1577","","specs/jetpack-boost/modules-common.test.js","Modules","","","The lazy-images module state should revert back to original state",""
"passed","Wed Dec 15 21:33:16 UTC 2021","Wed Dec 15 21:33:18 UTC 2021","1753","","specs/jetpack-boost/modules-common.test.js","Modules","","","The render-blocking-js module state should toggle to an inverse state",""
"passed","Wed Dec 15 21:33:15 UTC 2021","Wed Dec 15 21:33:16 UTC 2021","1619","","specs/jetpack-boost/modules-common.test.js","Modules","","","The render-blocking-js module should be disabled by default",""
"passed","Wed Dec 15 21:32:51 UTC 2021","Wed Dec 15 21:32:53 UTC 2021","1620","","specs/homepage.test.js","Homepage","","","Should display ""HelloWord"" text on page",""
"passed","Wed Dec 15 21:33:18 UTC 2021","Wed Dec 15 21:33:20 UTC 2021","1721","","specs/jetpack-boost/modules-common.test.js","Modules","","","The render-blocking-js module state should revert back to original state",""
"passed","Wed Dec 15 21:33:11 UTC 2021","Wed Dec 15 21:33:13 UTC 2021","1844","","specs/jetpack-boost/modules-common.test.js","Modules","","","The lazy-images module state should toggle to an inverse state",""
"passed","Wed Dec 15 21:33:20 UTC 2021","Wed Dec 15 21:33:21 UTC 2021","1595","","specs/jetpack-boost/speed-score.test.js","Speed Score feature","","","Should display a mobile and desktop speed score greater than zero",""
"passed","Wed Dec 15 21:33:06 UTC 2021","Wed Dec 15 21:33:10 UTC 2021","3408","","specs/jetpack-boost/modules-common.test.js","Modules","","","The critical-css module state should revert back to original state",""
