"Status","Start Time","Stop Time","Duration in ms","Parent Suite","Suite","Sub Suite","Test Class","Test Method","Name","Description"
"passed","Thu Jan 13 01:12:45 UTC 2022","Thu Jan 13 01:12:49 UTC 2022","3578","","specs/lazy-images.test.js","Lazy Images module","","","Images on a post should be lazy loaded when the module is active",""
"passed","Thu Jan 13 01:13:28 UTC 2022","Thu Jan 13 01:13:43 UTC 2022","15333","","specs/score-auto-refresh.test.js","Auto refresh of speed scores","","","Enabling lazy-images should refresh scores",""
"passed","Thu Jan 13 01:13:12 UTC 2022","Thu Jan 13 01:13:15 UTC 2022","3379","","specs/render-blocking-js.test.js","Render Blocking JS module","","","JavaScript on a post should be at its original position in the document when the module is inactive",""
"passed","Thu Jan 13 01:12:43 UTC 2022","Thu Jan 13 01:12:45 UTC 2022","2854","","specs/lazy-images.test.js","Lazy Images module","","","Images on a post should not be lazy loaded when the module is inactive",""
"passed","Thu Jan 13 01:13:43 UTC 2022","Thu Jan 13 01:14:27 UTC 2022","43911","","specs/score-auto-refresh.test.js","Auto refresh of speed scores","","","Enabling render-blocking-js should refresh scores",""
"passed","Thu Jan 13 01:09:58 UTC 2022","Thu Jan 13 01:10:02 UTC 2022","4554","","specs/common.test.js","","","","Click on the sidebar Boost Jetpack submenu should navigate to Boost settings page",""
"passed","Thu Jan 13 01:12:17 UTC 2022","Thu Jan 13 01:12:27 UTC 2022","9442","","specs/jetpack-compatibility.test.js","Jetpack compatibility","","","The Boost lazy-image module activation reflects in Jetpack dashboard",""
"passed","Thu Jan 13 01:11:23 UTC 2022","Thu Jan 13 01:11:27 UTC 2022","4258","","specs/critical-css.test.js","Critical CSS module","","","Critical CSS meta information should show on the admin when the module is re-activated",""
"passed","Thu Jan 13 01:11:50 UTC 2022","Thu Jan 13 01:11:53 UTC 2022","2894","","specs/critical-css.test.js","Critical CSS module","","","User can access the Critical advanced recommendations and go back to settings page",""
"passed","Thu Jan 13 01:12:11 UTC 2022","Thu Jan 13 01:12:17 UTC 2022","6628","","specs/jetpack-compatibility.test.js","Jetpack compatibility","","","The Jetpack lazy-image module deactivation reflects in Boost dashboard",""
"passed","Thu Jan 13 01:10:02 UTC 2022","Thu Jan 13 01:10:25 UTC 2022","22206","","specs/common.test.js","","","","Deactivating the plugin should clear Critical CSS and Dismissed Recommendation notice option",""
"passed","Thu Jan 13 01:13:04 UTC 2022","Thu Jan 13 01:13:04 UTC 2022","64","","specs/modules-common.test.js","Modules","","","The lazy-images module should be disabled by default",""
"passed","Thu Jan 13 01:10:30 UTC 2022","Thu Jan 13 01:10:48 UTC 2022","18138","","specs/connection.test.js","Settings Page Connection","","","Should connect to WP.com on a fresh install with Jetpack plugin activated and Jetpack already connected",""
"passed","Thu Jan 13 01:11:27 UTC 2022","Thu Jan 13 01:11:27 UTC 2022","228","","specs/critical-css.test.js","Critical CSS module","","","Critical CSS should be available on the frontend when the module is active",""
"passed","Thu Jan 13 01:14:43 UTC 2022","Thu Jan 13 01:14:57 UTC 2022","13255","","specs/speed-score.test.js","Speed Score feature","","","The Speed Scores should be able to refresh",""
"passed","Thu Jan 13 01:14:27 UTC 2022","Thu Jan 13 01:14:32 UTC 2022","4190","","specs/score-auto-refresh.test.js","Auto refresh of speed scores","","","Score refresh should debounce between multiple module toggle",""
"passed","Thu Jan 13 01:14:57 UTC 2022","Thu Jan 13 01:14:58 UTC 2022","1403","","specs/speed-score.test.js","Speed Score feature","","","Should be able to hover info icon next to overall score and see the detailed overall score description popin",""
"passed","Thu Jan 13 01:12:27 UTC 2022","Thu Jan 13 01:12:35 UTC 2022","8237","","specs/jetpack-compatibility.test.js","Jetpack compatibility","","","The Boost lazy-image module deactivation reflects in Jetpack dashboard",""
"passed","Thu Jan 13 01:13:06 UTC 2022","Thu Jan 13 01:13:06 UTC 2022","48","","specs/modules-common.test.js","Modules","","","The render-blocking-js module should be disabled by default",""
"passed","Thu Jan 13 01:11:15 UTC 2022","Thu Jan 13 01:11:23 UTC 2022","7487","","specs/critical-css.test.js","Critical CSS module","","","Critical CSS should be generated when the module is active",""
"passed","Thu Jan 13 01:11:13 UTC 2022","Thu Jan 13 01:11:15 UTC 2022","2437","","specs/critical-css.test.js","Critical CSS module","","","No Critical CSS should be available on the frontend when the module is inactive",""
"passed","Thu Jan 13 01:13:03 UTC 2022","Thu Jan 13 01:13:03 UTC 2022","362","","specs/modules-common.test.js","Modules","","","The critical-css module state should toggle to an inverse state",""
"passed","Thu Jan 13 01:13:04 UTC 2022","Thu Jan 13 01:13:05 UTC 2022","934","","specs/modules-common.test.js","Modules","","","The lazy-images module state should toggle to an inverse state",""
"passed","Thu Jan 13 01:14:32 UTC 2022","Thu Jan 13 01:14:43 UTC 2022","11810","","specs/speed-score.test.js","Speed Score feature","","","The Speed Score section should display a mobile and desktop speed score greater than zero",""
"passed","Thu Jan 13 01:09:53 UTC 2022","Thu Jan 13 01:09:58 UTC 2022","5033","","specs/common.test.js","","","","Click on the plugins page should navigate to Boost settings page",""
"passed","Thu Jan 13 01:13:06 UTC 2022","Thu Jan 13 01:13:06 UTC 2022","345","","specs/modules-common.test.js","Modules","","","The render-blocking-js module state should toggle to an inverse state",""
"passed","Thu Jan 13 01:11:38 UTC 2022","Thu Jan 13 01:11:50 UTC 2022","11814","","specs/critical-css.test.js","Critical CSS module","","","Critical CSS should be generated with an error (advanced recommendations)",""
"passed","Thu Jan 13 01:13:03 UTC 2022","Thu Jan 13 01:13:04 UTC 2022","325","","specs/modules-common.test.js","Modules","","","The critical-css module state should revert back to original state",""
"passed","Thu Jan 13 01:13:15 UTC 2022","Thu Jan 13 01:13:18 UTC 2022","3070","","specs/render-blocking-js.test.js","Render Blocking JS module","","","JavaScript on a post should be pushed at the bottom of the document when the module is active",""
"passed","Thu Jan 13 01:13:05 UTC 2022","Thu Jan 13 01:13:06 UTC 2022","847","","specs/modules-common.test.js","Modules","","","The lazy-images module state should revert back to original state",""
"passed","Thu Jan 13 01:10:48 UTC 2022","Thu Jan 13 01:10:56 UTC 2022","7778","","specs/connection.test.js","Settings Page Connection","","","Should connect to WP.com on a fresh install with Jetpack plugin activated",""
"passed","Thu Jan 13 01:11:27 UTC 2022","Thu Jan 13 01:11:38 UTC 2022","10720","","specs/critical-css.test.js","Critical CSS module","","","Critical CSS Admin message should show when the theme is changed",""
"passed","Thu Jan 13 01:10:56 UTC 2022","Thu Jan 13 01:11:05 UTC 2022","9482","","specs/connection.test.js","Settings Page Connection","","","Should connect to WP.com on a fresh install without Jetpack plugin activated",""
"passed","Thu Jan 13 01:12:03 UTC 2022","Thu Jan 13 01:12:11 UTC 2022","7841","","specs/jetpack-compatibility.test.js","Jetpack compatibility","","","The Jetpack lazy-image module activation reflects in Boost dashboard",""
"passed","Thu Jan 13 01:11:10 UTC 2022","Thu Jan 13 01:11:13 UTC 2022","2650","","specs/critical-css.test.js","Critical CSS module","","","No Critical CSS meta information should show on the admin when the module is inactive",""
"passed","Thu Jan 13 01:13:03 UTC 2022","Thu Jan 13 01:13:03 UTC 2022","74","","specs/modules-common.test.js","Modules","","","The critical-css module should be disabled by default",""
"passed","Thu Jan 13 01:13:06 UTC 2022","Thu Jan 13 01:13:06 UTC 2022","247","","specs/modules-common.test.js","Modules","","","The render-blocking-js module state should revert back to original state",""
