"Status","Start Time","Stop Time","Duration in ms","Parent Suite","Suite","Sub Suite","Test Class","Test Method","Name","Description"
"passed","Tue Jan 04 13:26:02 UTC 2022","Tue Jan 04 13:26:23 UTC 2022","20494","","specs/critical-css.test.js","Critical CSS module","","","Critical CSS Admin message should show when the theme is changed",""
"passed","Tue Jan 04 13:28:26 UTC 2022","Tue Jan 04 13:28:27 UTC 2022","61","","specs/modules-common.test.js","Modules","","","The render-blocking-js module should be disabled by default",""
"passed","Tue Jan 04 13:28:23 UTC 2022","Tue Jan 04 13:28:24 UTC 2022","518","","specs/modules-common.test.js","Modules","","","The critical-css module state should revert back to original state",""
"passed","Tue Jan 04 13:28:23 UTC 2022","Tue Jan 04 13:28:23 UTC 2022","517","","specs/modules-common.test.js","Modules","","","The critical-css module state should toggle to an inverse state",""
"passed","Tue Jan 04 13:28:34 UTC 2022","Tue Jan 04 13:28:39 UTC 2022","4758","","specs/render-blocking-js.test.js","Render Blocking JS module","","","JavaScript on a post should be at its original position in the document when the module is inactive",""
"passed","Tue Jan 04 13:25:05 UTC 2022","Tue Jan 04 13:25:16 UTC 2022","11299","","specs/connection.test.js","Settings Page Connection","","","Should connect to WP.com on a fresh install with Jetpack plugin activated",""
"passed","Tue Jan 04 13:28:42 UTC 2022","Tue Jan 04 13:28:45 UTC 2022","2292","","specs/speed-score.test.js","Speed Score feature","","","The Speed Score section should display a mobile and desktop speed score greater than zero",""
"passed","Tue Jan 04 13:24:51 UTC 2022","Tue Jan 04 13:25:05 UTC 2022","13757","","specs/connection.test.js","Settings Page Connection","","","Should connect to WP.com on a fresh install with Jetpack plugin activated and Jetpack already connected",""
"passed","Tue Jan 04 13:26:49 UTC 2022","Tue Jan 04 13:26:53 UTC 2022","3997","","specs/critical-css.test.js","Critical CSS module","","","User can access the Critical advanced recommendations and go back to settings page",""
"passed","Tue Jan 04 13:25:16 UTC 2022","Tue Jan 04 13:25:30 UTC 2022","13556","","specs/connection.test.js","Settings Page Connection","","","Should connect to WP.com on a fresh install without Jetpack plugin activated",""
"passed","Tue Jan 04 13:27:58 UTC 2022","Tue Jan 04 13:28:03 UTC 2022","4681","","specs/lazy-images.test.js","Lazy Images module","","","Images on a post should be lazy loaded when the module is active",""
"passed","Tue Jan 04 13:24:10 UTC 2022","Tue Jan 04 13:24:45 UTC 2022","35205","","specs/common.test.js","","","","Deactivating the plugin should clear Critical CSS and Dismissed Recommendation notice option",""
"passed","Tue Jan 04 13:27:54 UTC 2022","Tue Jan 04 13:27:58 UTC 2022","4054","","specs/lazy-images.test.js","Lazy Images module","","","Images on a post should not be lazy loaded when the module is inactive",""
"passed","Tue Jan 04 13:24:04 UTC 2022","Tue Jan 04 13:24:10 UTC 2022","5421","","specs/common.test.js","","","","Click on the sidebar Boost Jetpack submenu should navigate to Boost settings page",""
"passed","Tue Jan 04 13:27:26 UTC 2022","Tue Jan 04 13:27:35 UTC 2022","9899","","specs/jetpack-compatibility.test.js","Jetpack compatibility","","","The Boost lazy-image module activation reflects in Jetpack dashboard",""
"passed","Tue Jan 04 13:25:42 UTC 2022","Tue Jan 04 13:25:56 UTC 2022","13230","","specs/critical-css.test.js","Critical CSS module","","","Critical CSS should be generated when the module is active",""
"passed","Tue Jan 04 13:25:56 UTC 2022","Tue Jan 04 13:26:02 UTC 2022","6145","","specs/critical-css.test.js","Critical CSS module","","","Critical CSS meta information should show on the admin when the module is re-activated",""
"passed","Tue Jan 04 13:27:35 UTC 2022","Tue Jan 04 13:27:46 UTC 2022","10466","","specs/jetpack-compatibility.test.js","Jetpack compatibility","","","The Boost lazy-image module deactivation reflects in Jetpack dashboard",""
"passed","Tue Jan 04 13:27:07 UTC 2022","Tue Jan 04 13:27:16 UTC 2022","8793","","specs/jetpack-compatibility.test.js","Jetpack compatibility","","","The Jetpack lazy-image module activation reflects in Boost dashboard",""
"passed","Tue Jan 04 13:28:24 UTC 2022","Tue Jan 04 13:28:25 UTC 2022","1466","","specs/modules-common.test.js","Modules","","","The lazy-images module state should toggle to an inverse state",""
"passed","Tue Jan 04 13:28:23 UTC 2022","Tue Jan 04 13:28:23 UTC 2022","118","","specs/modules-common.test.js","Modules","","","The critical-css module should be disabled by default",""
"passed","Tue Jan 04 13:28:27 UTC 2022","Tue Jan 04 13:28:28 UTC 2022","493","","specs/modules-common.test.js","Modules","","","The render-blocking-js module state should revert back to original state",""
"passed","Tue Jan 04 13:28:39 UTC 2022","Tue Jan 04 13:28:42 UTC 2022","3685","","specs/render-blocking-js.test.js","Render Blocking JS module","","","JavaScript on a post should be pushed at the bottom of the document when the module is active",""
"passed","Tue Jan 04 13:26:23 UTC 2022","Tue Jan 04 13:26:49 UTC 2022","25638","","specs/critical-css.test.js","Critical CSS module","","","Critical CSS should be generated with an error (advanced recommendations)",""
"passed","Tue Jan 04 13:25:35 UTC 2022","Tue Jan 04 13:25:39 UTC 2022","3934","","specs/critical-css.test.js","Critical CSS module","","","No Critical CSS meta information should show on the admin when the module is inactive",""
"passed","Tue Jan 04 13:28:24 UTC 2022","Tue Jan 04 13:28:24 UTC 2022","71","","specs/modules-common.test.js","Modules","","","The lazy-images module should be disabled by default",""
"passed","Tue Jan 04 13:28:25 UTC 2022","Tue Jan 04 13:28:26 UTC 2022","1231","","specs/modules-common.test.js","Modules","","","The lazy-images module state should revert back to original state",""
"passed","Tue Jan 04 13:27:16 UTC 2022","Tue Jan 04 13:27:26 UTC 2022","9377","","specs/jetpack-compatibility.test.js","Jetpack compatibility","","","The Jetpack lazy-image module deactivation reflects in Boost dashboard",""
"passed","Tue Jan 04 13:26:02 UTC 2022","Tue Jan 04 13:26:02 UTC 2022","611","","specs/critical-css.test.js","Critical CSS module","","","Critical CSS should be available on the frontend when the module is active",""
"passed","Tue Jan 04 13:28:27 UTC 2022","Tue Jan 04 13:28:27 UTC 2022","492","","specs/modules-common.test.js","Modules","","","The render-blocking-js module state should toggle to an inverse state",""
"passed","Tue Jan 04 13:25:39 UTC 2022","Tue Jan 04 13:25:42 UTC 2022","3389","","specs/critical-css.test.js","Critical CSS module","","","No Critical CSS should be available on the frontend when the module is inactive",""
"passed","Tue Jan 04 13:23:56 UTC 2022","Tue Jan 04 13:24:04 UTC 2022","8706","","specs/common.test.js","","","","Click on the plugins page should navigate to Boost settings page",""
