"Status","Start Time","Stop Time","Duration in ms","Parent Suite","Suite","Sub Suite","Test Class","Test Method","Name","Description"
"passed","Mon Jan 17 07:22:40 UTC 2022","Mon Jan 17 07:22:52 UTC 2022","11802","","specs/connection.test.js","Settings Page Connection","","","Should connect to WP.com on a fresh install without Jetpack plugin activated",""
"passed","Mon Jan 17 07:22:30 UTC 2022","Mon Jan 17 07:22:40 UTC 2022","10333","","specs/connection.test.js","Settings Page Connection","","","Should connect to WP.com on a fresh install with Jetpack plugin activated",""
"passed","Mon Jan 17 07:22:17 UTC 2022","Mon Jan 17 07:22:30 UTC 2022","13262","","specs/connection.test.js","Settings Page Connection","","","Should connect to WP.com on a fresh install with Jetpack plugin activated and Jetpack already connected",""
"passed","Mon Jan 17 07:22:57 UTC 2022","Mon Jan 17 07:23:01 UTC 2022","3435","","specs/critical-css.test.js","Critical CSS module","","","No Critical CSS meta information should show on the admin when the module is inactive",""
"passed","Mon Jan 17 07:25:14 UTC 2022","Mon Jan 17 07:25:15 UTC 2022","310","","specs/modules-common.test.js","Modules","","","The render-blocking-js module state should toggle to an inverse state",""
"passed","Mon Jan 17 07:25:21 UTC 2022","Mon Jan 17 07:25:25 UTC 2022","4122","","specs/render-blocking-js.test.js","Render Blocking JS module","","","JavaScript on a post should be at its original position in the document when the module is inactive",""
"passed","Mon Jan 17 07:25:13 UTC 2022","Mon Jan 17 07:25:13 UTC 2022","399","","specs/modules-common.test.js","Modules","","","The critical-css module state should revert back to original state",""
"passed","Mon Jan 17 07:25:14 UTC 2022","Mon Jan 17 07:25:14 UTC 2022","596","","specs/modules-common.test.js","Modules","","","The lazy-images module state should revert back to original state",""
"passed","Mon Jan 17 07:26:24 UTC 2022","Mon Jan 17 07:26:37 UTC 2022","12701","","specs/speed-score.test.js","Speed Score feature","","","The Speed Scores should be able to refresh",""
"passed","Mon Jan 17 07:23:13 UTC 2022","Mon Jan 17 07:23:19 UTC 2022","5917","","specs/critical-css.test.js","Critical CSS module","","","Critical CSS meta information should show on the admin when the module is re-activated",""
"passed","Mon Jan 17 07:26:37 UTC 2022","Mon Jan 17 07:26:38 UTC 2022","1650","","specs/speed-score.test.js","Speed Score feature","","","Should be able to hover info icon next to overall score and see the detailed overall score description popin",""
"passed","Mon Jan 17 07:25:12 UTC 2022","Mon Jan 17 07:25:13 UTC 2022","397","","specs/modules-common.test.js","Modules","","","The critical-css module state should toggle to an inverse state",""
"passed","Mon Jan 17 07:25:13 UTC 2022","Mon Jan 17 07:25:13 UTC 2022","69","","specs/modules-common.test.js","Modules","","","The lazy-images module should be disabled by default",""
"passed","Mon Jan 17 07:23:04 UTC 2022","Mon Jan 17 07:23:13 UTC 2022","9546","","specs/critical-css.test.js","Critical CSS module","","","Critical CSS should be generated when the module is active",""
"passed","Mon Jan 17 07:25:15 UTC 2022","Mon Jan 17 07:25:15 UTC 2022","346","","specs/modules-common.test.js","Modules","","","The render-blocking-js module state should revert back to original state",""
"passed","Mon Jan 17 07:25:12 UTC 2022","Mon Jan 17 07:25:12 UTC 2022","96","","specs/modules-common.test.js","Modules","","","The critical-css module should be disabled by default",""
"passed","Mon Jan 17 07:23:47 UTC 2022","Mon Jan 17 07:23:51 UTC 2022","3634","","specs/critical-css.test.js","Critical CSS module","","","User can access the Critical advanced recommendations and go back to settings page",""
"passed","Mon Jan 17 07:24:19 UTC 2022","Mon Jan 17 07:24:30 UTC 2022","10458","","specs/jetpack-compatibility.test.js","Jetpack compatibility","","","The Boost lazy-image module activation reflects in Jetpack dashboard",""
"passed","Mon Jan 17 07:23:01 UTC 2022","Mon Jan 17 07:23:04 UTC 2022","2908","","specs/critical-css.test.js","Critical CSS module","","","No Critical CSS should be available on the frontend when the module is inactive",""
"passed","Mon Jan 17 07:23:19 UTC 2022","Mon Jan 17 07:23:20 UTC 2022","369","","specs/critical-css.test.js","Critical CSS module","","","Critical CSS should be available on the frontend when the module is active",""
"passed","Mon Jan 17 07:25:40 UTC 2022","Mon Jan 17 07:25:54 UTC 2022","13815","","specs/score-auto-refresh.test.js","Auto refresh of speed scores","","","Enabling lazy-images should refresh scores",""
"passed","Mon Jan 17 07:24:30 UTC 2022","Mon Jan 17 07:24:40 UTC 2022","10009","","specs/jetpack-compatibility.test.js","Jetpack compatibility","","","The Boost lazy-image module deactivation reflects in Jetpack dashboard",""
"passed","Mon Jan 17 07:25:25 UTC 2022","Mon Jan 17 07:25:29 UTC 2022","3458","","specs/render-blocking-js.test.js","Render Blocking JS module","","","JavaScript on a post should be pushed at the bottom of the document when the module is active",""
"passed","Mon Jan 17 07:26:12 UTC 2022","Mon Jan 17 07:26:24 UTC 2022","12090","","specs/speed-score.test.js","Speed Score feature","","","The Speed Score section should display a mobile and desktop speed score greater than zero",""
"passed","Mon Jan 17 07:26:08 UTC 2022","Mon Jan 17 07:26:12 UTC 2022","3924","","specs/score-auto-refresh.test.js","Auto refresh of speed scores","","","Score refresh should debounce between multiple module toggle",""
"passed","Mon Jan 17 07:24:49 UTC 2022","Mon Jan 17 07:24:53 UTC 2022","3888","","specs/lazy-images.test.js","Lazy Images module","","","Images on a post should not be lazy loaded when the module is inactive",""
"passed","Mon Jan 17 07:25:13 UTC 2022","Mon Jan 17 07:25:14 UTC 2022","689","","specs/modules-common.test.js","Modules","","","The lazy-images module state should toggle to an inverse state",""
"passed","Mon Jan 17 07:21:34 UTC 2022","Mon Jan 17 07:21:39 UTC 2022","5660","","specs/common.test.js","","","","Click on the plugins page should navigate to Boost settings page",""
"passed","Mon Jan 17 07:23:33 UTC 2022","Mon Jan 17 07:23:47 UTC 2022","14269","","specs/critical-css.test.js","Critical CSS module","","","Critical CSS should be generated with an error (advanced recommendations)",""
"passed","Mon Jan 17 07:24:53 UTC 2022","Mon Jan 17 07:24:57 UTC 2022","3861","","specs/lazy-images.test.js","Lazy Images module","","","Images on a post should be lazy loaded when the module is active",""
"passed","Mon Jan 17 07:21:43 UTC 2022","Mon Jan 17 07:22:11 UTC 2022","28110","","specs/common.test.js","","","","Deactivating the plugin should clear Critical CSS and Dismissed Recommendation notice option",""
"passed","Mon Jan 17 07:25:14 UTC 2022","Mon Jan 17 07:25:14 UTC 2022","60","","specs/modules-common.test.js","Modules","","","The render-blocking-js module should be disabled by default",""
"passed","Mon Jan 17 07:24:00 UTC 2022","Mon Jan 17 07:24:09 UTC 2022","9732","","specs/jetpack-compatibility.test.js","Jetpack compatibility","","","The Jetpack lazy-image module activation reflects in Boost dashboard",""
"passed","Mon Jan 17 07:24:09 UTC 2022","Mon Jan 17 07:24:19 UTC 2022","9835","","specs/jetpack-compatibility.test.js","Jetpack compatibility","","","The Jetpack lazy-image module deactivation reflects in Boost dashboard",""
"passed","Mon Jan 17 07:23:20 UTC 2022","Mon Jan 17 07:23:33 UTC 2022","13297","","specs/critical-css.test.js","Critical CSS module","","","Critical CSS Admin message should show when the theme is changed",""
"passed","Mon Jan 17 07:25:54 UTC 2022","Mon Jan 17 07:26:08 UTC 2022","13498","","specs/score-auto-refresh.test.js","Auto refresh of speed scores","","","Enabling render-blocking-js should refresh scores",""
"passed","Mon Jan 17 07:21:39 UTC 2022","Mon Jan 17 07:21:43 UTC 2022","3520","","specs/common.test.js","","","","Click on the sidebar Boost Jetpack submenu should navigate to Boost settings page",""
