"Status","Start Time","Stop Time","Duration in ms","Parent Suite","Suite","Sub Suite","Test Class","Test Method","Name","Description"
"passed","Wed Dec 15 17:40:40 UTC 2021","Wed Dec 15 17:40:43 UTC 2021","2639","","specs/jetpack-boost/modules-common.test.js","Modules","","","The critical-css module state should toggle to an inverse state",""
"skipped","Wed Dec 15 17:40:30 UTC 2021","Wed Dec 15 17:40:30 UTC 2021","0","","specs/homepage.test.js","Homepage","","","Should be ready",""
"passed","Wed Dec 15 17:40:53 UTC 2021","Wed Dec 15 17:40:56 UTC 2021","3671","","specs/jetpack-boost/modules-common.test.js","Modules","","","The render-blocking-js module should be disabled by default",""
"passed","Wed Dec 15 17:40:46 UTC 2021","Wed Dec 15 17:40:48 UTC 2021","1905","","specs/jetpack-boost/modules-common.test.js","Modules","","","The lazy-images module should be disabled by default",""
"passed","Wed Dec 15 17:41:00 UTC 2021","Wed Dec 15 17:41:03 UTC 2021","2426","","specs/jetpack-boost/speed-score.test.js","Speed Score feature","","","Should display a mobile and desktop speed score greater than zero",""
"passed","Wed Dec 15 17:40:58 UTC 2021","Wed Dec 15 17:41:00 UTC 2021","1965","","specs/jetpack-boost/modules-common.test.js","Modules","","","The render-blocking-js module state should revert back to original state",""
"passed","Wed Dec 15 17:40:56 UTC 2021","Wed Dec 15 17:40:58 UTC 2021","1860","","specs/jetpack-boost/modules-common.test.js","Modules","","","The render-blocking-js module state should toggle to an inverse state",""
"passed","Wed Dec 15 17:40:29 UTC 2021","Wed Dec 15 17:40:30 UTC 2021","1360","","specs/homepage.test.js","Homepage","","","Should include the jetpack boost meta tag(s)",""
"passed","Wed Dec 15 17:40:26 UTC 2021","Wed Dec 15 17:40:29 UTC 2021","2083","","specs/homepage.test.js","Homepage","","","Should display ""HelloWord"" text on page",""
"passed","Wed Dec 15 17:40:38 UTC 2021","Wed Dec 15 17:40:40 UTC 2021","1831","","specs/jetpack-boost/modules-common.test.js","Modules","","","The critical-css module should be disabled by default",""
"passed","Wed Dec 15 17:40:43 UTC 2021","Wed Dec 15 17:40:46 UTC 2021","3659","","specs/jetpack-boost/modules-common.test.js","Modules","","","The critical-css module state should revert back to original state",""
"passed","Wed Dec 15 17:40:51 UTC 2021","Wed Dec 15 17:40:53 UTC 2021","2039","","specs/jetpack-boost/modules-common.test.js","Modules","","","The lazy-images module state should revert back to original state",""
"passed","Wed Dec 15 17:40:48 UTC 2021","Wed Dec 15 17:40:51 UTC 2021","2189","","specs/jetpack-boost/modules-common.test.js","Modules","","","The lazy-images module state should toggle to an inverse state",""
